Desenvolvedor (A) Web/Mobile - Front-End, Área e especialização profissional: Informática, TI, Telecomunicações - Programador / Desenvolvedor;Nível hierárquico: Auxiliar;Local de trabalho: Campinas, SP;Responsabilidades: • Profissional irá atuar com desenvolvimento web e mobile; • Desenvolvimento e manutenção de aplicações sistêmicas, web e mobile; • Manutenção e criação de novas funcionalidades; • Desenvolvimento de funcionalidades principalmente front-end; • Desenvolvimento de novos ambientes, utilizando o sistema atual ou novo sistema; • Executar serviços de melhoria contínua em programas já desenvolvidos; • Executar tarefas de análise de bugs, desenvolvimento de correções, configuração e suporte relacionados a sistemas de informação.;Requisitos: Habilidades técnicas indispensáveis: FRONT-END WEB: HTML, CSS, JAVASCRIPT, JQUERY, TAGLIB, JSP, MATERIALIZE, ANGULAR, VUE.JS e REACT. DIFERENCIAL: BACK-END DEVELOPMENT: NETBEANS, JAVA, SQL, JSON, HIBERNATE, JSF/PRIMEFACES, MYSQL e SPRING. Habilidades pessoais: Ser uma pessoa criativa, ágil, proativa, engajada e com espírito de equipe. Experiência necessária: desenvolvedor web. Escolaridade: Graduação em Tecnologia da Informação, Ciência da Computação ou correlatas.;Escolaridade Mínima: Ensino Superior;Banco de dados: Firebird, Oracle, SQL Server, Sybase;Programação: PHP, jQuery, JavaScript, Python, HTML, CSS, Java;Gráficos/Web: Adobe Ilustrator, Adobe Photoshop, CorelDraw;Aplicações de Escritório: Microsoft Access, Microsoft Excel, Microsoft PowerPoint, Microsoft Word, Open Office;Sistemas Operacionais: Linux, Windows;Estacionamento, Vale-transporte
Desenvolvimento De Software - São Paulo - (Junior, Pleno E Sênior), Área e especialização profissional: Informática, TI, Telecomunicações - Programador / Desenvolvedor;Nível hierárquico: Analista;Local de trabalho: Osasco, SP;Os profissionais irão atuar em desenvolvimento de softwares e programação mobile para um renomado Banco de SP. As  são para perfis Junior, Pleno e Sênior, conforme especificação abaixo:;PROGRAMADOR PHP- HTML, TWITTER BOOTSTRAP, JAVASCRIPT, Shell Script (Pleno e Sênior);PROGRAMADOR PHYTON- Shell Script, DJANGO (Junior, Pleno e Sênior);PROGRAMADOR MOBILE- LINUX, API MANAGER (Pleno e Sênior);Programador SQL/ POSTGRESQL - Sênior;Programador MYSQL - Junior;Escolaridade Mínima: Ensino Superior;Banco de dados: PostgreSQL, SQL Server;Programação: HTML, JavaScript, jQuery, PHP, Python;Sistemas Operacionais: Linux
Devops Architect, Área e especialização profissional: Informática, TI, Telecomunicações - Programador / Desenvolvedor;Nível hierárquico: Analista;Local de trabalho: São Paulo, SP;"BD is the leading software development company in the Americas. With more than 1000 employees working on projects around the world, a sustained average annual growth of over 50%, and recognized by Inc. in the Top 10 Silicon Valley fastest-growing private companies, BD is guiding the digital transformation of some of the top companies in the world, such as Google, Rolls-Royce, Pinterest, EY, SiriusXM, Motorola & ViacomCBS.;Recognized by Clutch.co as a Top B2B Technology Services Company, BD has offices across the United States, Canada, Europe, and Latin America and offers an exceptional work environment in which employees can thrive, working in multicultural teams, with flexible schedules and endless growth opportunities.;BD is on a mission to offer world-class Custom Software Development services. The company employs only the Top 1% IT Talent to create solid engineering teams that provide end-to-end delivery of Technology Solutions. Be prepared to work alongside industry leaders on cutting-edge projects in a fast-paced, innovative environment.;We are looking for DevOps Architects to join our Development team and participate in different projects made up of multicultural teams distributed throughout the world. We are looking for proactive people, team players passionate about programming in this language and oriented to provide the best experience to the end user. This is an excellent opportunity for those professionals looking to develop in one of the fastest growing companies in the industry!;These developers will face numerous technical challenges, so they must use current technologies, get involved in the mobile world, web applications, devices, etc.;Main Activities:;Identify and automate solutions to improve the performance, monitoring, scalability, and overall stability of client platform.;Collaborate with engineering teams to support/maintain/design cloud infrastructure.;Work to ensure accuracy of the code build and deployment processes and advancing automation in this space.;Good understanding of issue management systems, project management, and version control (especially git), standard development tools, and engineering process/practices.;What are we looking for:;6+ years of experience working as DevOps.;Strong technical knowledge in technologies such as (but not limited to) UCS, Linux, SAN / NAS, virtualization (Openstack / VMware), and IaaS + PaaS + SaaS.;Development with Shell, Perl, Python.;Knowledge of compilers and accelerators (gmake, emake, etc.).;Strong leadership, and capacity for decision making.;Perks:;Excellent compensation plan, well above the market average.;Possibility of remote work and flexible schedules.;Training plans.;Extensive possibilities for growth and professional development thanks to our mentoring system.;If you are interested in being part of a team composed of the best professionals and working 100% goal-oriented in an innovative environment, do not hesitate to apply!;Escolaridade Mínima: Curso Técnico;Inglês (Avançado - Requerido)
Devops, Área e especialização profissional: Informática, TI, Telecomunicações - Programador / Desenvolvedor;Nível hierárquico: Analista;Local de trabalho: São Paulo, SP;Integração contínua com pipelines jenkins (groovy, shared lib, plugins);;Conteinerização de aplicações;;Orquestração de container com kubernetes e ECS;;Scripting em shell ou python;;IAC com terrafrom cloudformation;;monitoração com new relic ou prometheus + grafana;;Log centralizado com Elk + beats;;Versionamento de codigo com GIT;;AWS (Cloudfront, route53, S3, EC2, ECS, EKS, lambda, ECR, RDS, ELB, SQS, SNS, VPC (networking);;Prodiciência em linux;Escolaridade Mínima: Ensino Superior
Devops Ssr/Sr, Área e especialização profissional: Informática, TI, Telecomunicações - Programador / Desenvolvedor;Nível hierárquico: Analista;Local de trabalho: São Paulo, SP;"BD is the leading software development company in the Americas. With more than 1000 employees working on projects around the world, a sustained average annual growth of over 50%, and recognized by Inc. in the Top 10 Silicon Valley fastest-growing private companies, BD is guiding the digital transformation of some of the top companies in the world, such as Google, Rolls-Royce, Pinterest, EY, SiriusXM, Motorola & ViacomCBS.;Recognized by Clutch.co as a Top B2B Technology Services Company, BD has offices across the United States, Canada, Europe, and Latin America and offers an exceptional work environment in which employees can thrive, working in multicultural teams, with flexible schedules and endless growth opportunities.;BD is on a mission to offer world-class Custom Software Development services. The company employs only the Top 1% IT Talent to create solid engineering teams that provide end-to-end delivery of Technology Solutions. Be prepared to work alongside industry leaders on cutting-edge projects in a fast-paced, innovative environment.;We are looking for DevOps Developers to join our Development team and participate in different projects made up of multicultural teams distributed throughout the world. We are looking for proactive people, team players passionate about programming in this language and oriented to provide the best experience to the end user. This is an excellent opportunity for those professionals looking to develop in one of the fastest growing companies in the industry!;These developers will face numerous technical challenges, so they must use current technologies, get involved in the mobile world, web applications, devices, etc.;Main Activities:;Assist in infrastructure migration process to IaC (Infrastructure as Code).;Build and deploy monitoring and alerting systems across our entire infrastructure.;Complete migration to CI/CD deployment model.;Support integration projects with 3rd party services (Payment Rails, SMS/Email, KYC, Analytics, etc.).;Build, maintain, and own InfoSec compliance efforts by implementing and enforcing appropriate processes and standards across the organization.;What are we looking for:;5+ years of experience working as DevOps.;Strong technical knowledge in technologies such as (but not limited to) UCS, Linux, SAN / NAS, virtualization (Openstack / VMware), and IaaS + PaaS + SaaS.;Development with Shell, Perl, Python.;Knowledge of compilers and accelerators (gmake, emake, etc.).;Strong leadership, and capacity for decision making.;Perks:;Excellent compensation plan, well above the market average.;Possibility of remote work and flexible schedules.;Training plans.;Extensive possibilities for growth and professional development thanks to our mentoring system.;If you are interested in being part of a team composed of the best professionals and working 100% goal-oriented in an innovative environment, do not hesitate to apply!;Escolaridade Mínima: Curso Técnico;Inglês (Avançado - Requerido)
Devops Tech Lead, Área e especialização profissional: Informática, TI, Telecomunicações - Programador / Desenvolvedor;Nível hierárquico: Analista;Local de trabalho: São Paulo, SP;"BD is the leading software development company in the Americas. With more than 1000 employees working on projects around the world, a sustained average annual growth of over 50%, and recognized by Inc. in the Top 10 Silicon Valley fastest-growing private companies, BD is guiding the digital transformation of some of the top companies in the world, such as Google, Rolls-Royce, Pinterest, EY, SiriusXM, Motorola & ViacomCBS.;Recognized by Clutch.co as a Top B2B Technology Services Company, BD has offices across the United States, Canada, Europe, and Latin America and offers an exceptional work environment in which employees can thrive, working in multicultural teams, with flexible schedules and endless growth opportunities.;BD is on a mission to offer world-class Custom Software Development services. The company employs only the Top 1% IT Talent to create solid engineering teams that provide end-to-end delivery of Technology Solutions. Be prepared to work alongside industry leaders on cutting-edge projects in a fast-paced, innovative environment.;We are looking for DevOps Tech Leads to join our Development team and participate in different projects made up of multicultural teams distributed throughout the world. We are looking for proactive people, team players passionate about programming in this language and oriented to provide the best experience to the end user. This is an excellent opportunity for those professionals looking to develop in one of the fastest growing companies in the industry!;These developers will face numerous technical challenges, so they must use current technologies, get involved in the mobile world, web applications, devices, etc.;Main Activities:;Experience using DevOps toolsets/mindset, including CI/CD, configuration management and containerization.;Create full SDLC DevOps platforms.;Leading teams in an engineering capacity.;Create large-scale blueprints and roadmaps, including current & future states for infrastructure technology.;What are we looking for:;7+ years of experience working as DevOps.;Strong technical knowledge in technologies such as (but not limited to) UCS, Linux, SAN / NAS, virtualization (Openstack / VMware), and IaaS + PaaS + SaaS.;Development with Shell, Perl, Python.;Knowledge of compilers and accelerators (gmake, emake, etc.).;Strong leadership, and capacity for decision making.;Good communication and interpersonal relationships and be result-oriented.;Implement creative solutions that expand the range of services.;Perks:;Excellent compensation plan, well above the market average.;Possibility of remote work and flexible schedules.;Training plans.;Extensive possibilities for growth and professional development thanks to our mentoring system.;If you are interested in being part of a team composed of the best professionals and working 100% goal-oriented in an innovative environment, do not hesitate to apply!;Escolaridade Mínima: Curso Técnico;Inglês (Avançado - Requerido)
Etl Developer, Área e especialização profissional: Informática, TI, Telecomunicações - Programador / Desenvolvedor;Nível hierárquico: Analista;Local de trabalho: São Paulo, SP;BD is the leading software development company in the Americas. With more than 1000 employees working on projects around the world, a sustained average annual growth of over 50%, and recognized by Inc. in the Top 10 Silicon Valley fastest-growing private companies, BD is guiding the digital transformation of some of the top companies in the world, such as Google, Rolls-Royce, Pinterest, EY, SiriusXM, Motorola & ViacomCBS.;Recognized by Clutch.co as a Top B2B Technology Services Company, BD has offices across the United States, Canada, Europe, and Latin America and offers an exceptional work environment in which employees can thrive, working in multicultural teams, with flexible schedules and endless growth opportunities.;BD is on a mission to offer world-class Custom Software Development services. The company employs only the Top 1% IT Talent to create solid engineering teams that provide end-to-end delivery of Technology Solutions. Be prepared to work alongside industry leaders on cutting-edge projects in a fast-paced, innovative environment.;We are looking for ETL Developers to join our Development team and participate in different projects made up of multicultural teams distributed throughout the world. We are looking for proactive people, team players passionate about programming in this language and oriented to provide the best experience to the end user. This is an excellent opportunity for those professionals looking to develop in one of the fastest growing companies in the industry!;These developers will face numerous technical challenges, so they must use current technologies, get involved in the mobile world, web applications, devices, etc.;Main Activities:;Design and develop (enhancements and maintenance) new ETL Solutions.;Improve slow running jobs with the help of redesign and better ETL processes to meet business needs.;Support the team to design, model, develop, and maintain existing and new SQL databases objects required for all business solutions.;What are we looking for:;5+ years of experience in ETL Solutions development and expertise in designing and implementing Relational Database models per business needs.;Experience in Database Development, Design, Analysis, Support in Development, Testing and Production Environments with various business domains.;Python experience is a big plus.;Bachelor's Degree in Computer Science or equivalent is highly desirable.;Perks:;Excellent compensation plan, well above the market average.;Possibility of remote work and flexible schedules.;Training plans.;Extensive possibilities for growth and professional development thanks to our mentoring system.;If you are interested in being part of a team composed of the best professionals and working 100% goal-oriented in an innovative environment, do not hesitate to apply!;Escolaridade Mínima: Curso Técnico;Inglês (Avançado - Requerido)
Instrutor Programador De Games, Área e especialização profissional: Informática, TI, Telecomunicações - Programador / Desenvolvedor;Nível hierárquico: Operacional;Local de trabalho: Barueri, SP;"Estamos com  para trabalhar como Instrutor(a) de Programação e Robótica em nossa unidade de ALPHAVILLE;Se você é uma pessoa comunicativa, gosta de crianças e gosta de transmitir o seu conhecimento, venha fazer parte da família SuperGeeks. Temos  para perfil júnior e pleno.;O Instrutor(a) dará aulas para crianças de 5 até 17 anos, por isso, precisamos de pessoas que gostem de crianças e adolescentes e tenham grande responsabilidade.;Se você tem paixão por tecnologia, gosta de aprender e ensinar, tem bons conhecimento em ao menos uma linguagem de Programação, candidate-se imediatamente.";Exigências;1.	Escolaridade Mínima: Concluído ou cursando Faculdade de Jogos Digitais ou ADS;2.	Conhecimentos em Linguagem de programação – Construct 3, Scratch, Python, Unith, Unreal, Java e Arduino;Escolaridade Mínima: Ensino Superior;Programação: C#, C+, CSS, HTML, JavaScript, Python, Ruby
Programador Back-End - Home Office, Área e especialização profissional: Informática, TI, Telecomunicações - Programador / Desenvolvedor;Nível hierárquico: Analista;Local de trabalho: São Paulo, SP;Manter e implementar melhorias na plataforma, necessário ter conhecimento e experiência conforme abaixo: Linux, CI / CD, PHP 7, Laravel 5.4, Git Flow e MySQL. Necessário ter conhecimento / experiência com as linguagens de programação e atividades descritas.;Regime;Escolaridade Mínima: Ensino Superior;Banco de dados: Caché, SQL Server, PostgreSQL, Oracle, Sybase, Informix, Firebird, DB2, Interbase;Programação: HTML, R, Python, PHP, MATLAB, jQuery, JavaScript, Java, Erlang, C++, Cuda extensions, CSS, COBOL, Ruby, C+, C#, C, ASP.Net, ASP, Dot Net, VB.Net
Programador Front End - Pleno, Área e especialização profissional: Informática, TI, Telecomunicações - Programador / Desenvolvedor;Nível hierárquico: Especialista;Local de trabalho: São Paulo, SP;Descrição:;Irá programar interfaces de web e ferramentas de edição de imagem. Executa a manutenção dos sistemas, fazendo eventuais correções necessárias. Desenvolve trabalhos de montagem, depuração e testes de programas, executando serviços de manutenção nos programas já desenvolvidos.;Qualificação:;Competências técnicas necessárias: Experiência de pelo menos 5 anos, HTML 5.0, CSS 3.0, React (Mandatório), Javascript, Trabalhado com TDD;Conhecimento desejável: Conhecimento de UX, Conhecimento de projetos ágeis Scrum, Conhecimento de Python e seus frameworks webs: Django ou Flask é um diferencial.;Formação:;Nível superior em algum curso de tecnologia concluído ou próximo do término.;Local de trabalho:;São Paulo / SP;Escolaridade Mínima: Ensino Superior
Programador Java, Área e especialização profissional: Informática, TI, Telecomunicações - Programador / Desenvolvedor;Nível hierárquico: Especialista;Local de trabalho: São Paulo, SP;Conhecimento da linguagem Java, JPA/ Hibernate, bancos de dados relacionais, MVC/Bootstrap HTML5, Java Script, APls Rest;;Conhecimento de padrões de projeto;;Experiência comprovada de 3 anos no desenvolvimento de sistemas na linguagem Java.;Ensino Superior Completo em Engenharia da Computação ou Análises de Sistemas.;Inglês Intermediário.;Escolaridade Mínima: Ensino Superior;Português (Nativo), Inglês (Intermediário);Programação: ASP, Ruby, ASP, ASP.Net, C, C#, C+, C++, COBOL, VB.Net, CSS, Dot Net, Erlang, HTML, Java, JavaScript, jQuery, MATLAB, PHP, Cuda extensions, Python, R, Java, Cuda extensions, Dot Net, Erlang, HTML, C++, JavaScript, jQuery, MATLAB, PHP, Python, R, Ruby, C+, C#, C, VB.Net, ASP.Net, CSS, COBOL;Aplicações de Escritório: Microsoft PowerPoint, LibreOffice, Lotus Notes, Microsoft Access, Microsoft Outlook, Microsoft Word, Microsoft Excel, StarOffice, Open Office, Microsoft Word, Microsoft PowerPoint, Microsoft Outlook, Microsoft Excel, Microsoft Access, Lotus Notes, LibreOffice, Open Office, StarOffice
Programador  Java Junior - Av. Rebouças - Sp, Área e especialização profissional: Informática, TI, Telecomunicações - Programador / Desenvolvedor;Nível hierárquico: Analista;Número de vagas: 4;Local de trabalho: São Paulo, SP;desenvolvimento web em Java (Vraptor, Spring, ...) hibernate tanto para back-end como para front-end (full-stack);;Escolaridade Mínima: Ensino Superior;Programação: Java, JavaScript, Python
Programador Java Junior, Área e especialização profissional: Informática, TI, Telecomunicações - Análise de Sistema;Nível hierárquico: Estagiário;Local de trabalho: Jundiaí, SP;Profissional atuará como Desenvolvedor com foco em Java, É necessário possuir o conhecimento com as seguintes tecnologias: Git, Spring Framework, Spring Boot, SpringMVC, Spring Batch, PL/SQL, conhecimentos em metodologias ágeis. Conhecimento em Java, JSF, JPA, J2EE, Primefaces, Weblogic, GIT, Maven, Spring, Spring Boot, PL SQL.;Escolaridade Mínima: Ensino Superior;Inglês (Intermediário);Banco de dados: Oracle, PostgreSQL, SQL Server;Programação: ASP.Net, C#, C+, Dot Net, HTML, Java, JavaScript, jQuery, Python, VB.Net;Sistemas Operacionais: JavaOS, Linux, Windows;Vale-transporte
Programador Junior (Python), Área e especialização profissional: Administração - Administração Geral;Nível hierárquico: Operacional;Local de trabalho: São Paulo, SP;Estamos buscando um Programador Jr que seja fera em Python para compor nossa equipe da Stefanini.;Se você tem o que a gente precisa, gosta de desafios e da oportunidade de trabalhar com tecnologias de ponta no mercado;Requisitos:;· Ensino superior completo ou em andamento;;· Mínimo 6 meses (desejável 1 ano) de experiência com desenvolvimento Python.;Conhecimentos necessários para desempenhar a função:;· Desenvolvimento Python;;· Conhecimento básico de notação SQL para escrita de queries;;· Conhecimento básico em modelagem de dados (MER).;Conhecimentos desejáveis (diferenciais):;· Conhecimento básico em cloud (AWS);· Conhecimento básico em Serverless, Pipenv.;· Conhecimento básico em banco de dados relacionais ou NoSQL (Elasticsearch, Dynamodb, Redshift);;· Conhecimento básico de ETL, BI, Data lake, Big Data, análise de dados;;· Conhecimento sobre metodologia de gestão ágil (Scrum, Kanban) e/ou tradicional (RUP).
Programador Php, Área e especialização profissional: Informática, TI, Telecomunicações - Programador / Desenvolvedor;Nível hierárquico: Assistente;Local de trabalho: São Paulo, SP;Programar, desenvolver e implantar sistemas em linguagem PHP. Realizar correções em sistemas para atender as necessidades dos clientes / usuários.;Experiência em Laravel. Conhecimentos em Orientação a Objetos. Conhecimentos em PHP, MySQL, Experiência na construção de APIs REST. Experiência nas plataformas PHP, HTML, JavaScript, CSS3 e SQL (MySQL). Ter excelente comunicação, dinamismo e facilidade para integração com equipes em pleno desenvolvimento de projetos. Pontualidade. Cumprir prazos e metas.;Ensino Superior completo ou cursando, na área de Tecnologia da Informação.;Escolaridade Mínima: Ensino Superior;Banco de dados: Oracle, PostgreSQL, SQL Server;Programação: HTML, Java, JavaScript, PHP, Python;Sistemas Operacionais: Linux;Outros programas: Servidores Web;Ajuda de custo, Auxílio combustível, Bônus por resultado, Vale-alimentação
Programador Python, Área e especialização profissional: Informática, TI, Telecomunicações - Programador / Desenvolvedor;Nível hierárquico: Especialista;Local de trabalho: São Paulo, SP;Descrição:;Irá atuar no desenvolvimento e manutenção de software utilizando linguagem Python a com banco de dados padrão SQL ou similar.;Disponibilidade para viagens.;Qualificação:;Conhecimento da plataforma Raspberry Py. Experiência anterior no setor de automação comercial ou controle de acesso.;Idiomas:;Inglês - Básico;Formação:;Ensino superior completo.;Local de Trabalho:;São Paulo / SP - 1;Escolaridade Mínima: Ensino Superior
Programador Python Pleno, Área e especialização profissional: Informática, TI, Telecomunicações - TI;Nível hierárquico: Operacional;Local de trabalho: São Paulo, SP;Responsabilidades:;Profissional será responsável pela análise e desenvolvimento de sistemas, realizando programação no Backend em linguagem Python.;Responsável pelo desenvolvimento de sistemas legados e implementação de novas funcionalidades, adaptando soluções para atender as necessidades dos sistemas.;Requisitos:;Experiência em desenvolvimento de software backend.;Tecnologias: Python, framework Django, banco de dados MySQL, Rest API, Docker, arquitetura de microsserviços, Linux e testes Unitários.;Desejável: Conhecimentos em AWS, arquitetura orientada a eventos, Blockchain, Kubernetes, gestão e configuração de sistemas e experiência anterior no mercado de Exchange.;Perfil Comportamental:;Perfil flexível – facilidade de atuação em diferentes processos e metodologia de trabalho;;Senso crítico – capacidade de definir melhores métricas e soluções;;Facilidade de trabalhar em equipe.;Escolaridade Mínima: Ensino Superior
Programador Web, Área e especialização profissional: Informática, TI, Telecomunicações - Programador / Desenvolvedor;Nível hierárquico: Especialista;Local de trabalho: São Paulo, SP;C (framework 4.5 ou superior);;ASP.NET;;TDD;;DDD;;SQL Server 2014;;API, WebService, XML;;Windows service;;MVC,;JavaScript – JQUERY;;Ajax;;Orientação a objetos;;Bootstrap;;Visual Studio;Escolaridade Mínima: Ensino Superior;Português (Nativo);Programação: ASP, VB.Net, Ruby, R, Python, PHP, MATLAB, JavaScript, Java, HTML, jQuery, Dot Net, Erlang, C, C#, C+, ASP.Net, COBOL, CSS, Cuda extensions, C++;Aplicações de Escritório: Open Office, LibreOffice, Lotus Notes, Microsoft Access, Microsoft Excel, Microsoft Outlook, Microsoft PowerPoint, Microsoft Word, StarOffice
