Programador - Web, Área e especialização profissional: Informática, TI, Telecomunicações - Programador / Desenvolvedor;Nível hierárquico: Especialista;Local de trabalho: São Paulo, SP;Desenvolvimento de aplicações Web / Desktop. Implementação das funcionalidades levantadas pelo departamento de análise. Integração de Sistemas. Automação de Processos. Desenvolvimento de webservices. Manutenção em aplicações existentes. Análise de causa raiz dos problemas reportados.;Escolaridade Mínima: Ensino Superior;Português (Nativo), Inglês (Intermediário);Programação: HTML, Java, JavaScript, PHP, Python;Gráficos/Web: Adobe Ilustrator, Adobe Photoshop, Macromedia Dreamweaver;Sistemas Operacionais: Linux, Windows
Programador Web - Junior Ou Pleno, Área e especialização profissional: Informática, TI, Telecomunicações - Programador / Desenvolvedor;Nível hierárquico: Analista;Número de vagas: 2;Local de trabalho: Osasco, SP;É necessário ter experiência no desenvolvimento WEB, usando PHP, bem como conhecimentos aprofundados em:;PHP, Html, JavaScript e CSS, OOP (Programação Orientação a Objetos);;FrameWorks (Laravel, CodeIgniter, Symfony);;Arquitetura MVC, Cliente Servidor;;WebServices, API REST, SOAP;;Protocolos HTTP e HTTPS;;Banco de dados relacionais (MySQL, SQL Server, SQLite, Oracle) e não relacionais (MongoDB);;UX (Experiência do Usuário) e UI (Interface do Usuário);;Metodologia de teste de software, metodologias ágeis.;Escolaridade Mínima: Ensino Superior;Português (Intermediário), Inglês (Intermediário);Banco de dados: Caché, DB2, Firebird, Informix, Interbase, Oracle, PostgreSQL, SQL Server, Sybase;Programação: Java, JavaScript, jQuery, MATLAB, VB.Net, Python, Ruby, HTML, PHP, Erlang, R, Cuda extensions, CSS, COBOL, C++, C+, C#, C, ASP.Net, ASP, Dot Net;Gráficos/Web: Pixia, Paint Shop Pro, Macromedia Freehand, Macromedia Flash, Macromedia Fireworks, Macromedia Dreamweaver, Inkscape, Expression Web, CorelDraw , Blender, Adobe Photoshop, Adobe Ilustrator, 3ds Max, GIMP;Sistemas Operacionais: UNIX, Solaris, NT 4.0, NetBSD, IBM OS, Linux, JavaOS, FreeBSD, VMS, Mac OS, Windows;Assistência médica, Assistência odontológica, Comissões, Participação nos lucros, Seguro de Vida, Vale-alimentação, Vale-refeição, Vale-transporte
Python Architect, Área e especialização profissional: Informática, TI, Telecomunicações - Programador / Desenvolvedor;Nível hierárquico: Analista;Local de trabalho: São Paulo, SP;BD is the leading software development company in the Americas. With more than 1000 employees working on projects around the world, a sustained average annual growth of over 50%, and recognized by Inc. in the Top 10 Silicon Valley fastest-growing private companies, BD is guiding the digital transformation of some of the top companies in the world, such as Google, Rolls-Royce, Pinterest, EY, SiriusXM, Motorola & ViacomCBS.;Recognized by Clutch.co as a Top B2B Technology Services Company, BD has offices across the United States, Canada, Europe, and Latin America and offers an exceptional work environment in which employees can thrive, working in multicultural teams, with flexible schedules and endless growth opportunities.;BD is on a mission to offer world-class Custom Software Development services. The company employs only the Top 1% IT Talent to create solid engineering teams that provide end-to-end delivery of Technology Solutions. Be prepared to work alongside industry leaders on cutting-edge projects in a fast-paced, innovative environment.;We are looking for Python Architects to join our Development team and participate in different projects made up of multicultural teams distributed throughout the world. We are looking for proactive people, team players passionate about programming in this language and oriented to provide the best experience to the end user. This is an excellent opportunity for those professionals looking to develop in one of the fastest growing companies in the industry!;These developers will face numerous technical challenges, so they must use current technologies, get involved in the mobile world, web applications, devices, etc.;Main Activities:;Take full control of the projects in development.;Assemble, together with the product owner, the architecture plan (includes database model) and project development, including objectives with deadlines and clear metrics that will be periodically reviewed.;Perform, when necessary, the functional analysis of user requirements, as a link between the client and the development team.;Coordinate the team to achieve the objectives set in a timely manner. Human resources management including interview and hiring processes.;What are we looking for:;6+ years of practical experience in Python and Django development.;Experience in development with object-oriented programming is desirable.;3 years of development using other programming languages.;Good skills with XML and relational databases (Oracle / MS SQL / MySQL).;Experience with OOD.;Perks:;Excellent compensation plan, well above the market average.;Possibility of remote work and flexible schedules.;Training plans.;Extensive possibilities for growth and professional development thanks to our mentoring system.;If you are interested in being part of a team composed of the best professionals and working 100% goal-oriented in an innovative environment, do not hesitate to apply!;Escolaridade Mínima: Curso Técnico;Inglês (Avançado - Requerido)
Python + React Developer, Área e especialização profissional: Informática, TI, Telecomunicações - Programador / Desenvolvedor;Nível hierárquico: Analista;Local de trabalho: São Paulo, SP;"BD is the leading software development company in the Americas. With more than 1000 employees working on projects around the world, a sustained average annual growth of over 50%, and recognized by Inc. in the Top 10 Silicon Valley fastest-growing private companies, BD is guiding the digital transformation of some of the top companies in the world, such as Google, Rolls-Royce, Pinterest, EY, SiriusXM, Motorola & ViacomCBS.;Recognized by Clutch.co as a Top B2B Technology Services Company, BD has offices across the United States, Canada, Europe, and Latin America and offers an exceptional work environment in which employees can thrive, working in multicultural teams, with flexible schedules and endless growth opportunities.;BD is on a mission to offer world-class Custom Software Development services. The company employs only the Top 1% IT Talent to create solid engineering teams that provide end-to-end delivery of Technology Solutions. Be prepared to work alongside industry leaders on cutting-edge projects in a fast-paced, innovative environment.;We are looking for Python Developers to join our Development team and participate in different projects made up of multicultural teams distributed throughout the world. This is an excellent opportunity for those professionals looking to develop in one of the fastest growing companies in the industry!;Main Activities:;Create automation systems and tools to configure, monitor, and orchestrate data infrastructure and pipelines.;Create data integration services to help onboard new customers as quickly as possible.;Maintain ongoing reliability, performance, and support of the data infrastructure, providing solutions based on application needs and anticipated growth.;What are we looking for:;5+ years of practical experience in Python and Django development.;Good skills with XML and relational databases (Oracle / MS SQL / MySQL).;Strong professional experience working with large data structures (including XML) and algorithms.;4+ years of experience in Front End development with strong skills in Javascript, CSS3 and HTML5.;1+ year of experience developing Web applications using ReactJS, Flux, Redux, Relay, etc.;Experience with other Javascript Frameworks such as Angular, Backbone, Marionette.;Experience using ES2015 (ES6 / ES7).;Perks:;Work from home with flexible schedules.;Excellent compensation plan, well above the market average.;Extensive possibilities for growth and professional development thanks to our mentoring system.;At BD, remote work is at our core. Enjoy the opportunity to have a dynamic lifestyle, better health, and wellness. Find renewed passion in your job, improve your productivity, and benefit from attractive growth opportunities for your career.;If you are interested in being part of a team composed of the best professionals and working 100% goal-oriented in an innovative environment, do not hesitate to apply!;Escolaridade Mínima: Curso Técnico;Inglês (Avançado - Requerido)
Python Ssr/Sr, Área e especialização profissional: Informática, TI, Telecomunicações - Programador / Desenvolvedor;Nível hierárquico: Analista;Local de trabalho: São Paulo, SP;BD is the leading software development company in the Americas. With more than 1000 employees working on projects around the world, a sustained average annual growth of over 50%, and recognized by Inc. in the Top 10 Silicon Valley fastest-growing private companies, BD is guiding the digital transformation of some of the top companies in the world, such as Google, Rolls-Royce, Pinterest, EY, SiriusXM, Motorola & ViacomCBS.;Recognized by Clutch.co as a Top B2B Technology Services Company, BD has offices across the United States, Canada, Europe, and Latin America and offers an exceptional work environment in which employees can thrive, working in multicultural teams, with flexible schedules and endless growth opportunities.;BD is on a mission to offer world-class Custom Software Development services. The company employs only the Top 1% IT Talent to create solid engineering teams that provide end-to-end delivery of Technology Solutions. Be prepared to work alongside industry leaders on cutting-edge projects in a fast-paced, innovative environment.;We are looking for Python Developers to join our Development team and participate in different projects made up of multicultural teams distributed throughout the world. We are looking for proactive people, team players passionate about programming in this language and oriented to provide the best experience to the end user. This is an excellent opportunity for those professionals looking to develop in one of the fastest growing companies in the industry!;These developers will face numerous technical challenges, so they must use current technologies, get involved in the mobile world, web applications, devices, etc.;Main Activities:;Create automation systems and tools to configure, monitor, and orchestrate data infrastructure and pipelines.;Create data integration services to help onboard new customers as quickly as possible.;Maintain ongoing reliability, performance, and support of the data infrastructure, providing solutions based on application needs and anticipated growth.;What are we looking for:;5+ years of practical experience in Python and Django development.;Experience in development with object-oriented programming is desirable.;3 years of development using other programming languages.;Good skills with XML and relational databases (Oracle / MS SQL / MySQL).;Strong professional experience working with large data structures (including XML) and algorithms.;Perks:;Excellent compensation plan, well above the market average.;Possibility of remote work and flexible schedules.;Training plans.;Extensive possibilities for growth and professional development thanks to our mentoring system.;If you are interested in being part of a team composed of the best professionals and working 100% goal-oriented in an innovative environment, do not hesitate to apply!;Escolaridade Mínima: Curso Técnico;Inglês (Avançado - Requerido)
Python + Vuejs Developer, Área e especialização profissional: Informática, TI, Telecomunicações - Programador / Desenvolvedor;Nível hierárquico: Analista;Local de trabalho: São Paulo, SP;"BD is the leading software development company in the Americas. With more than 1000 employees working on projects around the world, a sustained average annual growth of over 50%, and recognized by Inc. in the Top 10 Silicon Valley fastest-growing private companies, BD is guiding the digital transformation of some of the top companies in the world, such as Google, Rolls-Royce, Pinterest, EY, SiriusXM, Motorola & ViacomCBS.;Recognized by Clutch.co as a Top B2B Technology Services Company, BD has offices across the United States, Canada, Europe, and Latin America and offers an exceptional work environment in which employees can thrive, working in multicultural teams, with flexible schedules and endless growth opportunities.;BD is on a mission to offer world-class Custom Software Development services. The company employs only the Top 1% IT Talent to create solid engineering teams that provide end-to-end delivery of Technology Solutions. Be prepared to work alongside industry leaders on cutting-edge projects in a fast-paced, innovative environment.;We are looking for Python Developers to join our Development team and participate in different projects made up of multicultural teams distributed throughout the world. This is an excellent opportunity for those professionals looking to develop in one of the fastest growing companies in the industry!;These developers will face numerous technical challenges, so they must use current technologies, get involved in the mobile world, web applications, devices, etc.;Main Activities:;Create automation systems and tools to configure, monitor, and orchestrate data infrastructure and pipelines.;Create data integration services to help onboard new customers as quickly as possible.;Developing, and testing UI for desktop and responsive websites.;Build reusable code and libraries for future use.;Accurately translate user and business needs into functional frontend code.;What are we looking for:;5+ years of practical experience in Python and Django development.;Experience in development with object-oriented programming is desirable.;Good skills with XML and relational databases (Oracle / MS SQL / MySQL).;Strong professional experience working with large data structures (including XML) and algorithms.;4+ years of experience in  Vue.Js development.;Experienced in service integrations (Web Services, CMS / Commerce systems, 3rd party APIs, etc).;Perks:;Work from home with flexible schedules.;Excellent compensation plan, well above the market average.;Training plans.;Extensive possibilities for growth and professional development thanks to our mentoring system.;If you are interested in being part of a team composed of the best professionals and working 100% goal-oriented in an innovative environment, do not hesitate to apply!;Escolaridade Mínima: Curso Técnico;Inglês (Avançado - Requerido)
Qa Automation Leader, Área e especialização profissional: Informática, TI, Telecomunicações - Programador / Desenvolvedor;Nível hierárquico: Analista;Local de trabalho: São Paulo, SP;BD is the leading software development company in the Americas. With more than 1000 employees working on projects around the world, a sustained average annual growth of over 50%, and recognized by Inc. in the Top 10 Silicon Valley fastest-growing private companies, BD is guiding the digital transformation of some of the top companies in the world, such as Google, Rolls-Royce, Pinterest, EY, SiriusXM, Motorola & ViacomCBS.;Recognized by Clutch.co as a Top B2B Technology Services Company, BD has offices across the United States, Canada, Europe, and Latin America and offers an exceptional work environment in which employees can thrive, working in multicultural teams, with flexible schedules and endless growth opportunities.;BD is on a mission to offer world-class Custom Software Development services. The company employs only the Top 1% IT Talent to create solid engineering teams that provide end-to-end delivery of Technology Solutions. Be prepared to work alongside industry leaders on cutting-edge projects in a fast-paced, innovative environment.;We are looking for QA Automation profiles to join our Analyst team and participate in different projects made up of multicultural teams distributed throughout the world. We are looking for proactive people, team players passionate about programming in this language and oriented to provide the best experience to the end user. This is an excellent opportunity for those professionals looking to develop in one of the fastest growing companies in the industry!;These developers will face numerous technical challenges, so they must use current technologies, get involved in the mobile world, web applications, devices, etc.;Main Activities:;Work closely with developers to create test cases, design test plans, and automate test cases for the verification of product functionality.;Work closely with developers Product Owners & Scrum Masters to review product requirements and design.;Manage and track Bugs and Enhancements (via JIRA and applicable tools).;Investigate and analyze product defects.;Develop and implement the Test Automation strategy.;Generate API Level Automated Test Scripts using various technologies and tools.;What are we looking for:;7+ years of experience in automated testing.;Good skills with C, C ++, Java and Python.;Deep knowledge of Unix and Linux environments.;Good command of both written and spoken English for daily work.;Perks:;Excellent compensation plan, well above the market average.;Possibility of remote work and flexible schedules.;Training plans.;Extensive possibilities for growth and professional development thanks to our mentoring system.;If you are interested in being part of a team composed of the best professionals and working 100% goal-oriented in an innovative environment, do not hesitate to apply!;Escolaridade Mínima: Curso Técnico;Inglês (Avançado - Requerido)
